<?xml version="1.0" encoding="UTF-8"?>
<CBlend xmlns="http://contentrepurpose.com/cblend"
        xmlns:xsi="http://www.w3.org/2001/XMLSchema-instance"
        xsi:schemaLocation="http://contentrepurpose.com/cblend cblend_schema_simple.xsd"
        id="BL001"
        status="completed">

    <Name>Welcome Blog Post</Name>
    <Purpose>Create a blog post introducing our platform to new users</Purpose>
    <CreatedBy>Marketing Team</CreatedBy>
    <CreatedDate>2026-02-15</CreatedDate>
    <TargetPlatform>blog</TargetPlatform>

    <SelectedBlocks>
        
        <BlockReference blockId="CB001">
            <Position>1</Position>
            <Notes>Use as introduction</Notes>
        </BlockReference>
        
        <BlockReference blockId="CB002">
            <Position>2</Position>
            <Notes>Visual break in the middle</Notes>
        </BlockReference>
        
        <BlockReference blockId="CB003">
            <Position>3</Position>
            <Notes>Show impressive numbers</Notes>
        </BlockReference>
        
        <BlockReference blockId="CB004">
            <Position>4</Position>
            <Notes>End with social proof</Notes>
        </BlockReference>
        
    </SelectedBlocks>

    <Modifications>
        
        <Modification id="MOD001">
            <Type>tone-change</Type>
            <Description>Changed tone to be more professional for blog audience</Description>
            <AppliedDate>2026-02-15</AppliedDate>
        </Modification>
        
        <Modification id="MOD002">
            <Type>expand</Type>
            <Description>Added more details to welcome message</Description>
            <AppliedDate>2026-02-15</AppliedDate>
        </Modification>
        
    </Modifications>

</CBlend>
